[
  {
    "id": "300",
    "suitColor": "#000000",
    "shirtColor": "#6495ed",
    "lapelColor": "#000000",
    "tieType": "tie",
    "pocketSquareType": "emptypocket"
  },
  {
    "id": "301",
    "suitColor": "#000000",
    "shirtColor": "#6495ed",
    "lapelColor": "#000000",
    "tieType": "bowtie",
    "pocketSquareType": "emptypocket"
  },
  {
    "id": "302",
    "suitColor": "#000000",
    "shirtColor": "#6495ed",
    "lapelColor": "#2a2a2a",
    "collarColor": "#ffffff",
    "tieType": "tie",
    "pocketSquareType": "emptypocket"
  },
  {
    "id": "303",
    "suitColor": "#000000",
    "shirtColor": "#6495ed",
    "collarColor": "#ffffff",
    "lapelColor": "#2a2a2a",
    "tieType": "tie",
    "pocketSquareType": "type2"
  },
  {
    "id": "304",
    "suitColor": "#000000",
    "shirtColor": "#909096",
    "lapelColor": "#000000",
    "tieType": "bowtie",
    "pocketSquareType": "emptypocket"
  },
  {
    "id": "305",
    "suitColor": "#000000",
    "shirtColor": "#909096",
    "lapelColor": "#000000",
    "collarColor": "#ffffff",
    "tieType": "tie",
    "pocketSquareType": "emptypocket"
  },
  {
    "id": "306",
    "suitColor": "#000000",
    "shirtColor": "#909096",
    "lapelColor": "#000000",
    "collarColor": "#ffffff",
    "tieType": "bowtie",
    "pocketSquareType": "type1"
  },
  {
    "id": "307",
    "suitColor": "#000000",
    "shirtColor": "#d3d3d3",
    "lapelColor": "#000000",
    "collarColor": "#ffffff",
    "tieType": "tie",
    "pocketSquareType": "none"
  },
  {
    "id": "308",
    "suitColor": "#0c0c0c",
    "shirtColor": "#ffffff",
    "lapelColor": "#2c2c2c",
    "tieType": "bowtie",
    "pocketSquareType": "type1"
  },
  {
    "id": "309",
    "suitColor": "#0c0c0c",
    "shirtColor": "#ffffff",
    "lapelColor": "#3c3c3c",
    "tieType": "tie",
    "pocketSquareType": "type2"
  },
  {
    "id": "310",
    "suitColor": "#121417",
    "shirtColor": "#d3d3d3",
    "lapelColor": "#4c4c4c",
    "collarColor": "#ffffff",
    "tieType": "tie",
    "pocketSquareType": "type1"
  },
  {
    "id": "311",
    "suitColor": "#292929",
    "shirtColor": "#ffffff",
    "lapelColor": "#000000",
    "tieType": "bowtie",
    "pocketSquareType": "emptypocket"
  },
  {
    "id": "312",
    "suitColor": "#292929",
    "shirtColor": "#ffffff",
    "lapelColor": "#000000",
    "tieType": "bowtie",
    "pocketSquareType": "type1"
  },
  {
    "id": "313",
    "suitColor": "#292929",
    "shirtColor": "#ffffff",
    "lapelColor": "#000000",
    "tieType": "tie",
    "pocketSquareType": "type2"
  },
  {
    "id": "314",
    "suitColor": "#32343d",
    "shirtColor": "#ffffff",
    "lapelColor": "#4c4e55",
    "tieType": "bowtie",
    "pocketSquareType": "emptypocket"
  },
  {
    "id": "315",
    "suitColor": "#32343d",
    "shirtColor": "#ffffff",
    "lapelColor": "#4c4e55",
    "tieType": "bowtie",
    "pocketSquareType": "type1"
  },
  {
    "id": "316",
    "suitColor": "#32343d",
    "shirtColor": "#ffffff",
    "lapelColor": "#4c4e55",
    "tieType": "bowtie",
    "pocketSquareType": "type2"
  },
  {
    "id": "317",
    "suitColor": "#32343d",
    "shirtColor": "#ffffff",
    "lapelColor": "#4c4e55",
    "tieType": "tie",
    "pocketSquareType": "type2"
  },
  {
    "id": "318",
    "suitColor": "#343d63",
    "shirtColor": "#ffffff",
    "lapelColor": "#2a3152",
    "tieType": "tie",
    "pocketSquareType": "type2"
  },
  {
    "id": "319",
    "suitColor": "#343d63",
    "shirtColor": "#ffffff",
    "lapelColor": "#2a3152",
    "tieType": "bowtie",
    "pocketSquareType": "type1"
  },
  {
    "id": "320",
    "suitColor": "#4682b4",
    "shirtColor": "#ffffff",
    "lapelColor": "#b0c4de",
    "tieType": "bowtie",
    "pocketSquareType": "type1"
  },
  {
    "id": "321",
    "suitColor": "#4682b4",
    "shirtColor": "#ffffff",
    "lapelColor": "#b0c4de",
    "tieType": "tie",
    "pocketSquareType": "emptypocket"
  },
  {
    "id": "322",
    "suitColor": "#4682b4",
    "shirtColor": "#ffffff",
    "lapelColor": "#b0c4de",
    "tieType": "tie",
    "pocketSquareType": "type1"
  },
  {
    "id": "323",
    "suitColor": "#68737c",
    "shirtColor": "#ffffff",
    "lapelColor": "#778899",
    "tieType": "tie",
    "pocketSquareType": "type2"
  },
  {
    "id": "324",
    "suitColor": "#9e824e",
    "shirtColor": "#ffffff",
    "lapelColor": "#c0954a",
    "tieType": "bowtie",
    "pocketSquareType": "emptypocket"
  },
  {
    "id": "325",
    "suitColor": "#c07f40",
    "shirtColor": "#ffffff",
    "lapelColor": "#fac490",
    "tieType": "tie",
    "pocketSquareType": "type2"
  },
  {
    "id": "326",
    "suitColor": "#d2b48c",
    "shirtColor": "#ffffff",
    "lapelColor": "#c3b091",
    "tieType": "tie",
    "pocketSquareType": "emptypocket"
  },
  {
    "id": "327",
    "suitColor": "#dfa062",
    "shirtColor": "#ffffff",
    "lapelColor": "#da9959",
    "tieType": "bowtie",
    "pocketSquareType": "emptypocket"
  },
  {
    "id": "328",
    "suitColor": "#dfa062",
    "shirtColor": "#ffffff",
    "lapelColor": "#fac490",
    "tieType": "bowtie",
    "pocketSquareType": "emptypocket"
  },
  {
    "id": "329",
    "suitColor": "#dfa062",
    "shirtColor": "#ffffff",
    "lapelColor": "#fac490",
    "tieType": "bowtie",
    "pocketSquareType": "type1"
  },
  {
    "id": "330",
    "suitColor": "#dfa062",
    "shirtColor": "#ffffff",
    "lapelColor": "#fac490",
    "collarColor": "#ffffff",
    "tieType": "tie",
    "pocketSquareType": "emptypocket"
  },
  {
    "id": "331",
    "suitColor": "#dfa062",
    "shirtColor": "#6495ed",
    "lapelColor": "#fac490",
    "collarColor": "#ffffff",
    "tieType": "tie",
    "pocketSquareType": "emptypocket"
  },
  {
    "id": "332",
    "suitColor": "#dfa062",
    "shirtColor": "#6495ed",
    "lapelColor": "#fac490",
    "collarColor": "#ffffff",
    "tieType": "bowtie",
    "pocketSquareType": "none"
  },
  {
    "id": "333",
    "suitColor": "#dfa062",
    "shirtColor": "#909096",
    "lapelColor": "#fac490",
    "collarColor": "#ffffff",
    "tieType": "tie",
    "pocketSquareType": "emptypocket"
  }
]
